{
  "id": "prompt-organizer",
  "name": "Prompt Organizer",
  "kind": "ui",
  "version": "0.1.0",
  "description": "Stores reusable AI prompts, substitutes variables, and copies rendered text. Owns the prompt schema in the shared toolbelt Supabase project.",
  "ownership": {
    "owner": "kylegsmith19@gmail.com",
    "path": "apps/toolbelt/apps/prompt-organizer"
  },
  "entry": {
    "ui": {
      "route": "/prompts"
    }
  },
  "schemas": ["prompt"],
  "permissions": {
    "db": {
      "read": ["prompt"],
      "write": ["prompt", "core"]
    },
    "networkEgress": [],
    "llmHandler": {
      "access": false
    }
  },
  "lifecycle": {
    "migrate": "gh workflow run platform-migrations.yml",
    "health": "node --test \"tests/*.test.mjs\"",
    "register": "20260812240000_register_prompt-organizer.sql"
  }
}
