{
  "id": "toolbelt",
  "name": "Toolbelt Root Spine",
  "kind": "headless",
  "version": "0.1.1",
  "description": "Shared root spine of the Toolbelt monorepo: owns the core schema (runs, costs, outcomes, metrics, events) that every tool writes through via core.log_run, plus the idea schema for the curated portfolio backlog. Not itself a UI or CLI surface.",
  "ownership": {
    "owner": "kylegsmith19@gmail.com",
    "path": "."
  },
  "entry": {
    "headless": {
      "command": "select core.purge_old_events();",
      "schedule": "0 3 * * *"
    }
  },
  "schemas": [
    "core",
    "idea"
  ],
  "permissions": {
    "db": {
      "read": [
        "core",
        "idea"
      ],
      "write": [
        "core",
        "idea"
      ]
    },
    "networkEgress": [],
    "llmHandler": {
      "access": false
    }
  },
  "lifecycle": {
    "migrate": "gh workflow run platform-migrations.yml",
    "health": "node --test \"tests/spine/*.test.mjs\"",
    "register": "20261030120000_register_toolbelt-ownership.sql"
  }
}
