{
  "id": "idea-intake",
  "name": "Idea Intake",
  "kind": "ui",
  "version": "0.1.1",
  "description": "Captures rough ideas as drafts, optionally optimizes them with LLM help, promotes the good ones, and converts each promoted idea into exactly one GitHub Issue that the app can never touch again. Owns the intake schema in the shared toolbelt Supabase project. Supersedes ACC's Forgepad.",
  "ownership": {
    "owner": "kylegsmith19@gmail.com",
    "path": "apps/idea-intake"
  },
  "entry": {
    "ui": {
      "route": "/ideas"
    }
  },
  "schemas": [
    "intake"
  ],
  "permissions": {
    "db": {
      "read": [
        "intake"
      ],
      "write": [
        "intake"
      ]
    },
    "networkEgress": [
      "api.github.com"
    ],
    "llmHandler": {
      "access": true
    }
  },
  "lifecycle": {
    "migrate": "gh workflow run platform-migrations.yml",
    "health": "node --test \"tests/*.test.mjs\"",
    "register": "20261030120200_register_idea-intake-ownership.sql"
  }
}
